date,username,name,user_bio,verified,type,text,retweets,likes,replies,quotes,tweet_url,lang,geo.full_name
2023-03-18 10:33:48+00:00,NickAnguelov,Nick Anguelov,"Associate Professor of Public Policy @UMassD, teaching statistics, researching globalization & sustainable development. Single & childless with no pets.",False,original,"NOWHERE because: ""Kassatly says Shein’s popularity with Gen Z may have to do with their believing the company is in fact acting sustainably — “like, Shein has a sustainability report,” she says."" TEACH YOUR CHILDREN TO NOT BELIEVE THE GREENWASHING LIES \nhttps://t.co/fTO1IAYDTu",0,2,0,1,https://twitter.com/NickAnguelov/status/1637039593034768386,en,
2023-03-18 02:27:33+00:00,Maryemame,Mary Ema,Fashion Designer / Creative Director / Dreamer #FashionDesigner #Artist #Fashion #WomeninBusiness #ArtDirector,False,original,Was 2022 the most important year for sustainable #Fashion? - Dazed https://t.co/K4qYHPb0Qz,0,1,0,0,https://twitter.com/Maryemame/status/1636917225704804353,en,
2023-03-14 18:03:00+00:00,greenwashdotcom,Greenwash.com,Take our site for a spin and see what comes out in the wash. \nA collaborative project owned by @changingmarkets to expose #greenwashing,True,original,"Entitled ‘A fashion focus: #Ethical clothing starts with industry collaboration’, a @boohoo-only panel last month was met with protesters as it talked about the role of collaboration in #ethical fashion. #greenwashing https://t.co/56aNlsrnWH @SourcingJournal @jasminchua",0,1,0,0,https://twitter.com/greenwashdotcom/status/1635703086323847168,en,
2023-03-05 16:53:07+00:00,alterindi,T_C_hiller,"27\nGermany,\nConservative,\nGay",False,retweet,"„Die Inflation wäre bei 100 Prozent, wenn wir uns von China abkoppeln“: Otto-Chef Birken spricht im SZ-Interview darüber, warum Deutschland es schwer hat, sich beim Klimaschutz von Diktaturen loszusagen. #SZPlus https://t.co/oxHIYzVSxc",5,18,7,2,https://twitter.com/alterindi/status/1632424010246938624,de,
2023-03-05 14:23:18+00:00,Algonfdez,Alberto,Socialista. Afiliado de Podemos. Votante desde 2015. Escorpión 1945.,False,retweet,"„Die Inflation wäre bei 100 Prozent, wenn wir uns von China abkoppeln“: Otto-Chef Birken spricht im SZ-Interview darüber, warum Deutschland es schwer hat, sich beim Klimaschutz von Diktaturen loszusagen. #SZPlus https://t.co/oxHIYzVSxc",5,18,7,2,https://twitter.com/Algonfdez/status/1632386307866386434,de,
2023-03-05 13:00:25+00:00,PT_Magazin,PT-Magazin,"https://t.co/qY63s6QQff, Oskar-Patzelt-Stiftung, Großer Preis des Mittelstandes",False,retweet,"„Die Inflation wäre bei 100 Prozent, wenn wir uns von China abkoppeln“: Otto-Chef Birken spricht im SZ-Interview darüber, warum Deutschland es schwer hat, sich beim Klimaschutz von Diktaturen loszusagen. #SZPlus https://t.co/jEXQ5l2wFA",2,2,0,0,https://twitter.com/PT_Magazin/status/1632365447180894214,de,
2023-03-05 12:54:24+00:00,AstridMind,Astrid,"Juristin, parteilos, Anhängerin des sozialen Rechtsstaats,",False,retweet,"„Die Inflation wäre bei 100 Prozent, wenn wir uns von China abkoppeln“: Otto-Chef Birken spricht im SZ-Interview darüber, warum Deutschland es schwer hat, sich beim Klimaschutz von Diktaturen loszusagen. #SZPlus https://t.co/oxHIYzVSxc",5,18,7,2,https://twitter.com/AstridMind/status/1632363933964148738,de,
2023-03-05 11:27:20+00:00,aynuripekipek,RuHu PeCeLi,"So Gott will...   \nFav, rt, hemfikir olduğumu göstermez.\nBeni kişiler değil fikirler ilgilendirir.\nDüşünceler ulaşılır ve özgürdür.\n\n2. hesap:@zerreden_nefese",False,retweet,"„Die Inflation wäre bei 100 Prozent, wenn wir uns von China abkoppeln“: Otto-Chef Birken spricht im SZ-Interview darüber, warum Deutschland es schwer hat, sich beim Klimaschutz von Diktaturen loszusagen. #SZPlus https://t.co/oxHIYzVSxc",5,18,7,2,https://twitter.com/aynuripekipek/status/1632342021380685824,de,
2023-03-05 10:54:22+00:00,SZ_TopNews,SZ Top-News,Alle Top-Themen von Süddeutsche.de\n\nImpressum: http://t.co/Jh8GYzR1nn,False,original,"„Die Inflation wäre bei 100 Prozent, wenn wir uns von China abkoppeln“: Otto-Chef Birken spricht im SZ-Interview darüber, warum Deutschland es schwer hat, sich beim Klimaschutz von Diktaturen loszusagen. #SZPlus https://t.co/cgAwRqFoSR",0,0,0,0,https://twitter.com/SZ_TopNews/status/1632333725106151424,de,
2023-03-05 10:54:21+00:00,SZ,Süddeutsche Zeitung,Der offizielle Twitter-Account der Süddeutschen Zeitung. Alle Redakteure und Kanäle: https://t.co/CGxKlwEv65 · Impressum: https://t.co/yuT9uOrH2B · https://t.co/lJSmJmoNKg,True,original,"„Die Inflation wäre bei 100 Prozent, wenn wir uns von China abkoppeln“: Otto-Chef Birken spricht im SZ-Interview darüber, warum Deutschland es schwer hat, sich beim Klimaschutz von Diktaturen loszusagen. #SZPlus https://t.co/oxHIYzVSxc",5,18,7,2,https://twitter.com/SZ/status/1632333723168284672,de,
2023-03-05 10:11:12+00:00,123_INFO_DE,123 INFO DE,Willkommen auf dem Twitter-Account von 123 INFO DE. hier findet ihr alle nationalen News | Tweets sind automatisch | Gruppe @GoNews_Off,False,original,"Klimakrise: ""Die Inflation wäre bei 100 Prozent, wenn wir uns von China abkoppeln""\n#123INFO\nhttps://t.co/3MbgyGIVJC",0,0,0,0,https://twitter.com/123_INFO_DE/status/1632322862823424002,de,
2023-03-05 09:47:55+00:00,DziennikB,Dziennik Berliński,,False,retweet,"„Die Inflation wäre bei 100 Prozent, wenn wir uns von China abkoppeln“: Otto-Chef Birken spricht im SZ-Interview darüber, warum Deutschland es schwer hat, sich beim Klimaschutz von Diktaturen loszusagen. #SZPlus https://t.co/jEXQ5l2wFA",2,2,0,0,https://twitter.com/DziennikB/status/1632317004483817472,de,
2023-03-05 09:42:34+00:00,SZ_Wirtschaft,SZ Wirtschaft,Impressum: https://t.co/Jh8GYzQtxP,False,original,"„Die Inflation wäre bei 100 Prozent, wenn wir uns von China abkoppeln“: Otto-Chef Birken spricht im SZ-Interview darüber, warum Deutschland es schwer hat, sich beim Klimaschutz von Diktaturen loszusagen. #SZPlus https://t.co/jEXQ5l2wFA",2,2,0,0,https://twitter.com/SZ_Wirtschaft/status/1632315658544316416,de,
2023-03-02 17:09:58+00:00,sarnydaichin,🎀𝓓𝓪𝓲𝓬𝓱𝓲𝓷 🎀,"• she/they • 24 • rus/eng •\nlgbtq+phobes, racists etc aren't welcome here 💅 •",False,reply,"Хочу также добавить, что бренды вроде Zara, H&amp;M и апогея быстрой моды Shein только (изредка) притворяются, что заботятся о природе, на самом деле в вещах может быть 2% переработанных материалов и они уже продвигают её как эко-френдли\nЭто называется greenwashing",0,43,1,0,https://twitter.com/sarnydaichin/status/1631341085409816576,ru,
2023-02-28 02:22:09+00:00,DLVermeer,Danielle Vermeer | Teleport ✨,co-founder & ceo of @teleport__app // building the future of thrifted fashion // 11+ years of only secondhand clothes,False,quote/reply,"@ehjrdn @AjaSaysHello @lingerie_addict While it’s possible (esp given Shein’s IPO aspirations), it’s more likely just a case of Hanlon’s Razor \n\nBtw, I wrote about greenwashing as a form of psyops recently https://t.co/S2xjNjrI1Z",0,1,0,0,https://twitter.com/DLVermeer/status/1630392883395133441,en,
2023-02-18 10:15:38+00:00,arantingreader,Jemima 🌱 #StopJackdaw (she/her),🏴󠁧󠁢󠁷󠁬󠁳󠁿 climate justice journalist + campaigner • ambassador @remakeourworld •                   💌 anotherrantingreader@gmail.com,False,retweet,"Protestors are calling out the likes of Boohoo and Shein for ""greenwashing"" their social and environmental efforts. https://t.co/NpRtHnDd8N",2,8,1,0,https://twitter.com/arantingreader/status/1626888160977321984,en,
2023-02-18 02:01:35+00:00,Net2Ayurveda,DeinAyurvedaNet2,,False,retweet,"Protestors are calling out the likes of Boohoo and Shein for ""greenwashing"" their social and environmental efforts. https://t.co/NpRtHnDd8N",2,8,1,0,https://twitter.com/Net2Ayurveda/status/1626763830217830401,en,
2023-02-16 23:07:20+00:00,boywonder_brand,Boy Wonder - @ismayatboywonder@fashionsocial.host,"Sustainable style for boys 👕 Quirky, hand-drawn prints 🎨 Organic cotton made in Britain 🇬🇧 Growth room, repair kit & care guides🧵 Visit our shop 👇",False,retweet,Thank you @jasminchua for covering our recent protest against @SHEIN_Official in @NewcastleSU and the protest against @boohoo by an incredible team. Fast fashion companies should not be able to show their faces at events without challenge https://t.co/eWRPEI1KbJ,5,18,0,0,https://twitter.com/boywonder_brand/status/1626357589419122691,en,
2023-02-16 22:33:50+00:00,CBCarpentier,Christopher Carpentier,#ProductMarketing at Instructure. @WPCareySchool (MBA) & @FAUBusiness alum. #iamwpcarey,False,original,RT @WPCareySchool: 'Things can go sideways quickly': @ASU marketing expert says #EthicalFashion protests may be leading to a tipping point in the #FastFashion industry. https://t.co/8a6JmYhxsD via @SourcingJournal https://t.co/LEuVCBC7gl,0,0,0,0,https://twitter.com/CBCarpentier/status/1626349161523171329,en,
2023-02-16 22:30:02+00:00,WPCareySchool,W. P. Carey School,"Official account for W. P. Carey School of Business at @ASU. We transform the world through access, excellence, and innovation in business knowledge.",False,original,'Things can go sideways quickly': @ASU marketing expert says #EthicalFashion protests may be leading to a tipping point in the #FastFashion industry. https://t.co/gSQ0YRZPMd via @SourcingJournal https://t.co/tGwGHrk1BZ,0,0,1,0,https://twitter.com/WPCareySchool/status/1626348204039053323,en,
2023-02-16 18:17:09+00:00,therealest007,IG: @fashionising101,A girl from the swamp that likes to talk #Fashion #Sports! #Model #NFL TV/Radio https://t.co/TKFttEFdJp #FashionTech #Sustainability #VC #Fitness #runway to #podcasts,False,retweet,Thank you @jasminchua for covering our recent protest against @SHEIN_Official in @NewcastleSU and the protest against @boohoo by an incredible team. Fast fashion companies should not be able to show their faces at events without challenge https://t.co/eWRPEI1KbJ,5,18,0,0,https://twitter.com/therealest007/status/1626284565047218177,en,
2023-02-16 13:52:54+00:00,BesmaCC,Besma | Curiously Conscious,Finding kinder ways to live and dress at https://t.co/lNAME60TWb • Founder https://t.co/YP6NlaH84a,False,retweet,Thank you @jasminchua for covering our recent protest against @SHEIN_Official in @NewcastleSU and the protest against @boohoo by an incredible team. Fast fashion companies should not be able to show their faces at events without challenge https://t.co/eWRPEI1KbJ,5,18,0,0,https://twitter.com/BesmaCC/status/1626218063556411392,en,
2023-02-16 12:30:49+00:00,jasminchua,Jasmin Malik Chua,Sourcing and labor editor 👗 👠 @sourcingjournal. Previous bylines @nytimes @bof @voguebusiness @voxdotcom @thedailybeast. ☁️ bsky @jasminchua.com,False,retweet,Thank you @jasminchua for covering our recent protest against @SHEIN_Official in @NewcastleSU and the protest against @boohoo by an incredible team. Fast fashion companies should not be able to show their faces at events without challenge https://t.co/eWRPEI1KbJ,5,18,0,0,https://twitter.com/jasminchua/status/1626197403849355265,en,
2023-02-16 10:17:12+00:00,MkImaan,iman | WATCH POLITE SOCIETY 🥻 🥋,Muslim 🇵🇰 | he/him\nCriminology Student\nhttps://t.co/qPpapWQbST\n@gndrising Socials Team (on hiatus)\n#BlackLivesMatter #FreeKashmir #FreePalestine,False,retweet,Thank you @jasminchua for covering our recent protest against @SHEIN_Official in @NewcastleSU and the protest against @boohoo by an incredible team. Fast fashion companies should not be able to show their faces at events without challenge https://t.co/eWRPEI1KbJ,5,18,0,0,https://twitter.com/MkImaan/status/1626163782010515460,en,
2023-02-16 10:15:20+00:00,arantingreader,Jemima 🌱 #StopJackdaw (she/her),🏴󠁧󠁢󠁷󠁬󠁳󠁿 climate justice journalist + campaigner • ambassador @remakeourworld •                   💌 anotherrantingreader@gmail.com,False,original,Thank you @jasminchua for covering our recent protest against @SHEIN_Official in @NewcastleSU and the protest against @boohoo by an incredible team. Fast fashion companies should not be able to show their faces at events without challenge https://t.co/eWRPEI1KbJ,5,18,0,0,https://twitter.com/arantingreader/status/1626163312114139137,en,
2023-02-16 07:15:49+00:00,manunbt,Emmanuel Norbert,,False,retweet,"Thanks for mentioning H&amp;M greenwashing efforts, they needed the promo…\nAlso, Shein grossing $16 Billions in 2021 peddling fast fashion sounds a bit obscene?\nThe message that “sustainable” fashion needs to get cheaper is off, address consumerism + garment longevity instead. https://t.co/btbgHLnvpI",2,6,1,0,https://twitter.com/manunbt/status/1626118135509139457,en,
2023-02-16 06:15:31+00:00,WellDressedDad,Nick J - Garmology podcast & WellDressedDad IG,"Nick Johannessen, host of Garmology podcast and Youtube and WellDressedDad Instagram and blog. Norwegian, into ethical menswear, tweed, denim and cool things.",False,retweet,"Thanks for mentioning H&amp;M greenwashing efforts, they needed the promo…\nAlso, Shein grossing $16 Billions in 2021 peddling fast fashion sounds a bit obscene?\nThe message that “sustainable” fashion needs to get cheaper is off, address consumerism + garment longevity instead. https://t.co/btbgHLnvpI",2,6,1,0,https://twitter.com/WellDressedDad/status/1626102958717902849,en,
2023-02-16 02:32:38+00:00,_MisterFreedom_,Christophe Loiron,MISTER FREEDOM® Blog: https://t.co/CsbnwnxU2Y,False,quote,"Thanks for mentioning H&amp;M greenwashing efforts, they needed the promo…\nAlso, Shein grossing $16 Billions in 2021 peddling fast fashion sounds a bit obscene?\nThe message that “sustainable” fashion needs to get cheaper is off, address consumerism + garment longevity instead. https://t.co/btbgHLnvpI",2,6,1,0,https://twitter.com/_MisterFreedom_/status/1626046869909692423,en,
2023-02-15 23:40:08+00:00,jasminchua,Jasmin Malik Chua,Sourcing and labor editor 👗 👠 @sourcingjournal. Previous bylines @nytimes @bof @voguebusiness @voxdotcom @thedailybeast. ☁️ bsky @jasminchua.com,False,original,"Protestors are calling out the likes of Boohoo and Shein for ""greenwashing"" their social and environmental efforts. https://t.co/NpRtHnDd8N",2,8,1,0,https://twitter.com/jasminchua/status/1626003457751625731,en,
2023-02-10 05:47:41+00:00,apparel_res,Apparel Resources,"Apparel Resources is a sourcing platform that provides latest #apparel and #textile industry #news , updates, and insights.",False,original,#ARfeatures - #Brands will need to be extremely watchful about how they speak about their #sustainability-related projects and #achievements to ensure they are not ‘greenwashing’ in light of new and emerging rules. \n@hm @SHEIN_Official \n#organic\n\nhttps://t.co/mlURewEiBn,0,0,0,0,https://twitter.com/apparel_res/status/1623921626185342977,en,
2023-02-06 19:41:56+00:00,VelocVeloc,VelocVeloc,"J'ai pas pus chier dans le cul de la réussite, je suis constipé\nhttps://t.co/9b3AzATuhq",False,reply,@Linda_anges6off @Audreylunique https://t.co/a4DSVTyW3k,0,1,0,0,https://twitter.com/VelocVeloc/status/1622682019921596435,qme,
2023-01-28 15:29:31+00:00,YourCutestEnemy,YourCutestEnemy🏳️‍🌈🏳️‍⚧️,Ex-Twitch PC Variety Streamer • Partnered with @DubbyEnergy @voicemod @RitualMotion • Business Email: YourCutestEnemyLive@gmail.com,False,reply,"H&amp;M- mistreats and underpays of employees, greenwashing\n\nGap- abuse of employees, withholding payment from workers,  uses forced labor from China \n\nShein- steals art and work from small creators, bad environmental impact\n\nTwitch- constant sexism, racism, and transphobia, Amazon^",0,2,2,0,https://twitter.com/YourCutestEnemy/status/1619357008725159937,en,
2023-01-22 23:35:29+00:00,brycejustweeted,Bryce Goodall | He/Him | Autistic/ND,QUEER 🏳️‍🌈 NEURODIVERGENT🧠CLIMATE🌱 SOCIAL✊ DISABILITY ♿ JUSTICE ACTIVIST ✊ ORGANISER✳️MOBILISER 📢CAMPAIGNER💥RT/QT/LIKE≠ ENDORSE/APPROVAL🚫,True,quote,Hey @SHEIN_Official do you mean: \nFashion Exploitation Lab \nElegant PR cover ups which is full of greenwashing\nDelight in getting profits but don't care about your workers rights abuse details. https://t.co/APFy4O0pf2,0,0,1,0,https://twitter.com/brycejustweeted/status/1617304976715284481,en,
2023-01-20 15:33:22+00:00,Mariangellw,Manguito🥭,Con sabor natural y artificial,False,retweet,Pintar de “eco friendly” “sustentable”. Mientras permites emprendimientos que traen ropa de shein es otra forma de greenwashing https://t.co/gMO9o2KlHt,2,24,2,0,https://twitter.com/Mariangellw/status/1616458871740026881,es,
2023-01-20 14:32:24+00:00,notvalemo,V🪬,🏳️‍🌈,False,retweet,Pintar de “eco friendly” “sustentable”. Mientras permites emprendimientos que traen ropa de shein es otra forma de greenwashing https://t.co/gMO9o2KlHt,2,24,2,0,https://twitter.com/notvalemo/status/1616443533023641602,es,
2023-01-20 06:48:10+00:00,vivaelgreenwash,Viva el Greenwashing,"Alertando sobre el #greenwashing del sector del textil \nAlerting on #greenwashing in the textile sector\nNos caen mal los mentirosos, los aprovechados, los ...",False,original,@SHEIN_Official tiene todo el derecho a vender la #ropa #fastfashion dentro de lo que permite la laxísima legislación y con la connivencia de sus clientes \n\nLo que no tiene derecho es a denominarla #sostenible\n\nSi aún así lo hace… pues #greenwashing\n\nhttps://t.co/4PFXo7OA4T,0,0,0,0,https://twitter.com/vivaelgreenwash/status/1616326701402755073,es,
2023-01-20 00:10:30+00:00,deathman00789,Bryan,Wait what? |28|\n\nProfile art by @athunderheart\nBanner art by @_brina_bee,False,retweet,"Apparently ""a majority of Gen Z will shop to support causes they care about"" but will this spell out the end of Shein's dominance, a business who cares about virtually no one?  Or will some of the greenwashing/woke washing actions continue to work on unsuspecting folks?",1,10,1,0,https://twitter.com/deathman00789/status/1616226625674256385,en,
2023-01-20 00:02:33+00:00,AjaSaysHello,Aja Barber,"She/her/they. Author of Consumed. Contributing editor at @ElleUK. Fashion is best when it is slow, ethical and inclusive! https://t.co/AOWSwVPjX1",False,reply,"Apparently ""a majority of Gen Z will shop to support causes they care about"" but will this spell out the end of Shein's dominance, a business who cares about virtually no one?  Or will some of the greenwashing/woke washing actions continue to work on unsuspecting folks?",1,10,1,0,https://twitter.com/AjaSaysHello/status/1616224627717541890,en,
2023-01-19 17:21:58+00:00,citlapilcod,cit,,False,quote,Pintar de “eco friendly” “sustentable”. Mientras permites emprendimientos que traen ropa de shein es otra forma de greenwashing https://t.co/gMO9o2KlHt,2,24,2,0,https://twitter.com/citlapilcod/status/1616123814445826050,es,
2023-01-14 17:22:10+00:00,Just_Becca,Becca✨🌙,"I’ve never been a natural, all I do is try. She/Her",False,reply,"@8lexnicole Nah they’re talking about Shein greenwashing and offering a ✨secondhand✨ selection on their site. Shein Exchange. \n\nBasically a bandaid for all the harm they do to the environment anyways lmfao. It’s a shit version of Poshmark, basically, with a lot more restrictions.",0,2,0,0,https://twitter.com/Just_Becca/status/1614311925273473025,en,
2023-01-10 14:31:00+00:00,MDOloruntoba,Modupe Oloruntoba,"🇳🇬 in 🇿🇦 writing for/about fashion, beauty & creative industries in South Africa for +9yrs. Now building @af_weekly.\n\nSubscribe for fashion business news 📩",False,retweet,From my Dazed article: https://t.co/vnPX46tjnL,1,5,0,0,https://twitter.com/MDOloruntoba/status/1612819301576179714,en,
2023-01-10 10:00:01+00:00,iownjd,J.D.™🇨🇩🇹🇷🇧🇪 🇫🇷🇸🇪🇺🇸🏁,"A @nerdinajock's body🐢perpetual optimist, learn, grow, inform, inspire, engage, empower: Be cute, but real in this ugly world ✨. Welcome to the bright side 💫.",True,retweet,"""From a fashion perspective, 2022 closed on a bitter note, with ultra-fast fashion brand Shein named the most popular brand in the world, and more greenwashing initiatives than we could wish for,"" @liviafirth writes. \nhttps://t.co/6sBdFUszef",1,2,0,0,https://twitter.com/iownjd/status/1612751104982368260,en,
2023-01-10 08:28:02+00:00,SophieBenson_,Sophie Benson,"Sustainability columnist @Dazed | Author and freelance journalist working with a focus on sustainable fashion, the environment, workers’ rights, and consumerism",False,reply,From my Dazed article: https://t.co/vnPX46tjnL,1,5,0,0,https://twitter.com/SophieBenson_/status/1612727957260304386,en,
2023-01-09 06:37:50+00:00,SizzlerzCloset,SIZZLERZ CLOSET,Fashion . curated by @sizzlermagazine,False,retweet,"@Ros_Rodriguez_ @DonnachadhMc @BoycottPalmOil @PlasticsRebel @JoannaMMeyer @JorgeLWolpert @OliviaMLondon @XRBrighton @GeoffBeacon @Sdg13Un I think there is a growing awareness regarding the profound impact of #fastfashion. There are several 2nd hand or #thrift shops where I live (a progressive city in the northeast US), but many of the biggest international players (@SHEIN_Official, @ZARA) are really #greenwashing. https://t.co/6zWCTUZ7Jl",3,8,1,2,https://twitter.com/SizzlerzCloset/status/1612337834882666497,en,
2023-01-08 23:48:09+00:00,SubsumeMe,Eric T,"♒️ Obsessive compulsive perfectionist, to a fault. But I still like to make things in the analog world.",False,reply,"@newacctwhoandy @dieworkwear @azizulis I’ve been doing that for years, but it seems like the story remains the same. I guess you just can’t change others’ buying behaviours. With greenwashing being prevalent everywhere, it just seems like a losing battle. Not to mention things like Shein. H+M’s got nothing on them …",0,1,0,0,https://twitter.com/SubsumeMe/status/1612234734905466883,en,
2023-01-08 23:27:09+00:00,OliviaMLondon,Olivia M Ⓥ,Tofu eating wokerati. Car free. ♥️🚴‍♂️. Join a union! Human rights. Animal rights. Rejoin.,False,retweet,"@Ros_Rodriguez_ @DonnachadhMc @BoycottPalmOil @PlasticsRebel @JoannaMMeyer @JorgeLWolpert @OliviaMLondon @XRBrighton @GeoffBeacon @Sdg13Un I think there is a growing awareness regarding the profound impact of #fastfashion. There are several 2nd hand or #thrift shops where I live (a progressive city in the northeast US), but many of the biggest international players (@SHEIN_Official, @ZARA) are really #greenwashing. https://t.co/6zWCTUZ7Jl",3,8,1,2,https://twitter.com/OliviaMLondon/status/1612229449805713408,en,
2023-01-08 22:31:26+00:00,BoycottPalmOil,Rajan Naidu Ⓥ,@kangaroocaught\n#Community\n#Peace\n#HumanRights\n#AnimalRights\n#ClimateJustice\n#HS2Rebellion\n#FareFreePublicTransport\n#XR\n#JustStopOil\n#BoycottPalmOil\n#BDS,False,retweet,"@Ros_Rodriguez_ @DonnachadhMc @BoycottPalmOil @PlasticsRebel @JoannaMMeyer @JorgeLWolpert @OliviaMLondon @XRBrighton @GeoffBeacon @Sdg13Un I think there is a growing awareness regarding the profound impact of #fastfashion. There are several 2nd hand or #thrift shops where I live (a progressive city in the northeast US), but many of the biggest international players (@SHEIN_Official, @ZARA) are really #greenwashing. https://t.co/6zWCTUZ7Jl",3,8,1,2,https://twitter.com/BoycottPalmOil/status/1612215428969009152,en,
2023-01-08 22:30:29+00:00,EcofriendlyBeer,Ecofriendly Beer Drinker,Curious. Environmental Studies at Harvard Extension School. Sustainability Consultant. Let’s take better care of Earth - the only planet with craft beer. 🌎🍻,True,reply,"@Ros_Rodriguez_ @DonnachadhMc @BoycottPalmOil @PlasticsRebel @JoannaMMeyer @JorgeLWolpert @OliviaMLondon @XRBrighton @GeoffBeacon @Sdg13Un I think there is a growing awareness regarding the profound impact of #fastfashion. There are several 2nd hand or #thrift shops where I live (a progressive city in the northeast US), but many of the biggest international players (@SHEIN_Official, @ZARA) are really #greenwashing. https://t.co/6zWCTUZ7Jl",3,8,1,2,https://twitter.com/EcofriendlyBeer/status/1612215188874317824,en,
2023-01-06 08:56:23+00:00,coolsarkyprints,Sarah,https://t.co/CUx85EoKGv\nhttps://t.co/uMwEbwbznG…\n Join Newsletter https://t.co/L3XIpar87p,False,retweet,"""The 2022 Fashion Accountability Report from Remake, an organisation which is instrumental in numerous global campaigns including #PayUp, has laid bare exactly which brands are falling short &amp; where."" via Dazed 💚 https://t.co/YykC3xY40i",2,2,0,0,https://twitter.com/coolsarkyprints/status/1611285538291548164,en,
2023-01-06 06:34:52+00:00,VogueArabia,Vogue Arabia,Vogue Arabia's official Twitter. Online now https://t.co/dH7OYYMfAy and https://t.co/9VhpBtzlf1,False,original,"""From a fashion perspective, 2022 closed on a bitter note, with ultra-fast fashion brand Shein named the most popular brand in the world, and more greenwashing initiatives than we could wish for,"" @liviafirth writes. \nhttps://t.co/6sBdFUszef",1,2,0,0,https://twitter.com/VogueArabia/status/1611249926511394821,en,
2023-01-05 20:03:33+00:00,itosheva,Irina Tosheva,модна дизајнерка.,False,retweet,"""The 2022 Fashion Accountability Report from Remake, an organisation which is instrumental in numerous global campaigns including #PayUp, has laid bare exactly which brands are falling short &amp; where."" via Dazed 💚 https://t.co/YykC3xY40i",2,2,0,0,https://twitter.com/itosheva/status/1611091050814136333,en,
