date,username,name,user_bio,verified,type,text,retweets,likes,replies,quotes,tweet_url,lang,geo.full_name
2022-08-05 21:03:42+00:00,fiete_haller,stonksandstones,// account closed -  do not disturb //,False,retweet,"Shein: \nUltra Fast Fashion, Labelklau, keine Transparenz, Polyester 1000, furchtbare Arbeitsbedingungen, ""Casino Features"", Greenwashing, Verdacht auf Kinderarbeit\n\nVERSUS\n\nKiNder traGeN in DeutsChlANd ZeitUNgen aUs!!!1111 https://t.co/EI82fvMV79",53,1104,51,7,https://twitter.com/fiete_haller/status/1555660843173519360,de,
2022-08-05 21:02:30+00:00,HerrgottMe,herrgottME,"Immer wieder aufstehen, Lachen, Leidenschaft für IT",False,retweet,"Shein: \nUltra Fast Fashion, Labelklau, keine Transparenz, Polyester 1000, furchtbare Arbeitsbedingungen, ""Casino Features"", Greenwashing, Verdacht auf Kinderarbeit\n\nVERSUS\n\nKiNder traGeN in DeutsChlANd ZeitUNgen aUs!!!1111 https://t.co/EI82fvMV79",53,1104,51,7,https://twitter.com/HerrgottMe/status/1555660539736588295,de,
2022-08-05 19:59:59+00:00,ihr_gossenpoet,dave,another artist/author/photographer \n// \na hug a day keeps the bourgeoisie away\n☠️,False,retweet,"Shein: \nUltra Fast Fashion, Labelklau, keine Transparenz, Polyester 1000, furchtbare Arbeitsbedingungen, ""Casino Features"", Greenwashing, Verdacht auf Kinderarbeit\n\nVERSUS\n\nKiNder traGeN in DeutsChlANd ZeitUNgen aUs!!!1111 https://t.co/EI82fvMV79",53,1104,51,7,https://twitter.com/ihr_gossenpoet/status/1555644806889709570,de,
2022-08-05 19:13:03+00:00,Antje1411,Aberaberaber ☮️,"I stand with Ukraine! Stop Putin! #noafd Nazis raus! Mama, Lerntherapeutin",False,retweet,"Shein: \nUltra Fast Fashion, Labelklau, keine Transparenz, Polyester 1000, furchtbare Arbeitsbedingungen, ""Casino Features"", Greenwashing, Verdacht auf Kinderarbeit\n\nVERSUS\n\nKiNder traGeN in DeutsChlANd ZeitUNgen aUs!!!1111 https://t.co/EI82fvMV79",53,1104,51,7,https://twitter.com/Antje1411/status/1555632998225268737,de,
2022-08-05 18:26:53+00:00,Heikepopeike,bloodandcoffee 💙💛,Seeking asylum is not a crime.  \nGirls are awesome. Don't be a cunt.,False,retweet,"Shein: \nUltra Fast Fashion, Labelklau, keine Transparenz, Polyester 1000, furchtbare Arbeitsbedingungen, ""Casino Features"", Greenwashing, Verdacht auf Kinderarbeit\n\nVERSUS\n\nKiNder traGeN in DeutsChlANd ZeitUNgen aUs!!!1111 https://t.co/EI82fvMV79",53,1104,51,7,https://twitter.com/Heikepopeike/status/1555621378279227397,de,
2022-08-05 18:01:09+00:00,AlexElvers,Aley 🐍🇺🇦📯,Softwareentwickly Machine Learning. Folgen Sie unauffällig.,False,retweet,"Shein: \nUltra Fast Fashion, Labelklau, keine Transparenz, Polyester 1000, furchtbare Arbeitsbedingungen, ""Casino Features"", Greenwashing, Verdacht auf Kinderarbeit\n\nVERSUS\n\nKiNder traGeN in DeutsChlANd ZeitUNgen aUs!!!1111 https://t.co/EI82fvMV79",53,1104,51,7,https://twitter.com/AlexElvers/status/1555614905264488450,de,
2022-08-05 17:39:56+00:00,derdortmunder77,Carsten W,,False,retweet,"Shein: \nUltra Fast Fashion, Labelklau, keine Transparenz, Polyester 1000, furchtbare Arbeitsbedingungen, ""Casino Features"", Greenwashing, Verdacht auf Kinderarbeit\n\nVERSUS\n\nKiNder traGeN in DeutsChlANd ZeitUNgen aUs!!!1111 https://t.co/EI82fvMV79",53,1104,51,7,https://twitter.com/derdortmunder77/status/1555609562849443840,de,
2022-08-05 17:38:29+00:00,KlausMaussen,Maurice Claußen,"Profilbild: © Blickpunkt Photodesign, Bödeker",False,retweet,"Shein: \nUltra Fast Fashion, Labelklau, keine Transparenz, Polyester 1000, furchtbare Arbeitsbedingungen, ""Casino Features"", Greenwashing, Verdacht auf Kinderarbeit\n\nVERSUS\n\nKiNder traGeN in DeutsChlANd ZeitUNgen aUs!!!1111 https://t.co/EI82fvMV79",53,1104,51,7,https://twitter.com/KlausMaussen/status/1555609197068406784,de,
2022-08-05 17:15:54+00:00,KptnDigital,Bastian,your travel agent on your digital journey. loves StreetFood & podcast. #StreetFoodBros  #freivonderleber,False,retweet,"Shein: \nUltra Fast Fashion, Labelklau, keine Transparenz, Polyester 1000, furchtbare Arbeitsbedingungen, ""Casino Features"", Greenwashing, Verdacht auf Kinderarbeit\n\nVERSUS\n\nKiNder traGeN in DeutsChlANd ZeitUNgen aUs!!!1111 https://t.co/EI82fvMV79",53,1104,51,7,https://twitter.com/KptnDigital/status/1555603514436587522,de,
2022-08-05 17:03:18+00:00,Giggles_FI,Oberschwester Hildegard 🏳️‍🌈,a-ha | Hamburgliebe | Kaffee | Winter | Not just sad | Nazis raus | bin keine Oberschwester,False,retweet,"Shein: \nUltra Fast Fashion, Labelklau, keine Transparenz, Polyester 1000, furchtbare Arbeitsbedingungen, ""Casino Features"", Greenwashing, Verdacht auf Kinderarbeit\n\nVERSUS\n\nKiNder traGeN in DeutsChlANd ZeitUNgen aUs!!!1111 https://t.co/EI82fvMV79",53,1104,51,7,https://twitter.com/Giggles_FI/status/1555600345618939905,de,
2022-08-05 16:50:15+00:00,AndreasAndy3131,Andreas Grunewald,"„Wir wollen eine Saison erleben, die wir nie vergessen!“ 🖤💛 🖤💛 🖤💛",False,retweet,"Shein: \nUltra Fast Fashion, Labelklau, keine Transparenz, Polyester 1000, furchtbare Arbeitsbedingungen, ""Casino Features"", Greenwashing, Verdacht auf Kinderarbeit\n\nVERSUS\n\nKiNder traGeN in DeutsChlANd ZeitUNgen aUs!!!1111 https://t.co/EI82fvMV79",53,1104,51,7,https://twitter.com/AndreasAndy3131/status/1555597062204522499,de,
2022-08-05 16:34:13+00:00,PleasurPleasur,Lena,"Eigene Tweets kommen nur zu Trash TV lol, sonst nur Retweets zu wichtigeren Themen 😵‍💫🤝🏻",False,retweet,"Shein: \nUltra Fast Fashion, Labelklau, keine Transparenz, Polyester 1000, furchtbare Arbeitsbedingungen, ""Casino Features"", Greenwashing, Verdacht auf Kinderarbeit\n\nVERSUS\n\nKiNder traGeN in DeutsChlANd ZeitUNgen aUs!!!1111 https://t.co/EI82fvMV79",53,1104,51,7,https://twitter.com/PleasurPleasur/status/1555593024977223684,de,
2022-08-05 16:29:48+00:00,SanSchein,Herbst,,False,retweet,"Shein: \nUltra Fast Fashion, Labelklau, keine Transparenz, Polyester 1000, furchtbare Arbeitsbedingungen, ""Casino Features"", Greenwashing, Verdacht auf Kinderarbeit\n\nVERSUS\n\nKiNder traGeN in DeutsChlANd ZeitUNgen aUs!!!1111 https://t.co/EI82fvMV79",53,1104,51,7,https://twitter.com/SanSchein/status/1555591915059421184,de,
2022-08-05 15:32:55+00:00,AtomHerbert,AtomHerbert 🇪🇺🇺🇦,More Retweets than Tweets.\n#FCKPTN\n#European\n#gegenrechts\n#noAfD,False,retweet,"Shein: \nUltra Fast Fashion, Labelklau, keine Transparenz, Polyester 1000, furchtbare Arbeitsbedingungen, ""Casino Features"", Greenwashing, Verdacht auf Kinderarbeit\n\nVERSUS\n\nKiNder traGeN in DeutsChlANd ZeitUNgen aUs!!!1111 https://t.co/EI82fvMV79",53,1104,51,7,https://twitter.com/AtomHerbert/status/1555577597572022272,de,
2022-08-05 15:22:44+00:00,_Drea87,Nala@Home😌,FFXIV💖//Persona/Zelda 💖//Level 36//08.03.❤//Springchild🌺//Paladin🛡//Hades and G'raha ✨💞//Doggos🐶//🏳️‍🌈,False,retweet,"Shein: \nUltra Fast Fashion, Labelklau, keine Transparenz, Polyester 1000, furchtbare Arbeitsbedingungen, ""Casino Features"", Greenwashing, Verdacht auf Kinderarbeit\n\nVERSUS\n\nKiNder traGeN in DeutsChlANd ZeitUNgen aUs!!!1111 https://t.co/EI82fvMV79",53,1104,51,7,https://twitter.com/_Drea87/status/1555575035070488578,de,
2022-08-05 15:13:37+00:00,fujimiyaran,Hotaru ~till the end of the line,Hotaru / Sandra || thirty-something || she/her || tweeting in german and english || private account: @starry_sunflowr,False,retweet,"Shein: \nUltra Fast Fashion, Labelklau, keine Transparenz, Polyester 1000, furchtbare Arbeitsbedingungen, ""Casino Features"", Greenwashing, Verdacht auf Kinderarbeit\n\nVERSUS\n\nKiNder traGeN in DeutsChlANd ZeitUNgen aUs!!!1111 https://t.co/EI82fvMV79",53,1104,51,7,https://twitter.com/fujimiyaran/status/1555572743843741696,de,
2022-08-05 14:40:09+00:00,MissNiche_,✨ Nerd Prinzessin 👑 | Brokkolipizza 🥦🍕,"✨✨✨Public Account✨✨✨\n\nCosplay, RPG, Fanfiction, Gaming 🍒\n\nShe/Her\n\nLevel 29+\n\nPlaying #GenshinImpact",False,retweet,"Shein: \nUltra Fast Fashion, Labelklau, keine Transparenz, Polyester 1000, furchtbare Arbeitsbedingungen, ""Casino Features"", Greenwashing, Verdacht auf Kinderarbeit\n\nVERSUS\n\nKiNder traGeN in DeutsChlANd ZeitUNgen aUs!!!1111 https://t.co/EI82fvMV79",53,1104,51,7,https://twitter.com/MissNiche_/status/1555564318229467136,de,
2022-08-05 14:10:53+00:00,petite_ran,Ran,Biologist. Beware of my mutant-algae. 30+,False,retweet,"Shein: \nUltra Fast Fashion, Labelklau, keine Transparenz, Polyester 1000, furchtbare Arbeitsbedingungen, ""Casino Features"", Greenwashing, Verdacht auf Kinderarbeit\n\nVERSUS\n\nKiNder traGeN in DeutsChlANd ZeitUNgen aUs!!!1111 https://t.co/EI82fvMV79",53,1104,51,7,https://twitter.com/petite_ran/status/1555556954050908160,de,
2022-08-05 14:06:26+00:00,FreuleinFuchs27,Frl. Fuchs,"Nur hier, um Nazis zu ärgern - #vegan #fckafd #niemehrcdu #MarkBeneckeUltra #TeamGrün",False,retweet,"Shein: \nUltra Fast Fashion, Labelklau, keine Transparenz, Polyester 1000, furchtbare Arbeitsbedingungen, ""Casino Features"", Greenwashing, Verdacht auf Kinderarbeit\n\nVERSUS\n\nKiNder traGeN in DeutsChlANd ZeitUNgen aUs!!!1111 https://t.co/EI82fvMV79",53,1104,51,7,https://twitter.com/FreuleinFuchs27/status/1555555834444267523,de,
2022-08-05 14:05:50+00:00,5imulacrum,Li,"half introverted, half rock'n'roll.\n\n@Simulacrum@medibubble.org",False,retweet,"Shein: \nUltra Fast Fashion, Labelklau, keine Transparenz, Polyester 1000, furchtbare Arbeitsbedingungen, ""Casino Features"", Greenwashing, Verdacht auf Kinderarbeit\n\nVERSUS\n\nKiNder traGeN in DeutsChlANd ZeitUNgen aUs!!!1111 https://t.co/EI82fvMV79",53,1104,51,7,https://twitter.com/5imulacrum/status/1555555682866298881,de,
2022-08-05 13:44:41+00:00,Mr_JK27,🦾 Spectacular Ricochet 🦾,@RedLotty169 = geheiratete Herzkönigin ❤️💍,False,retweet,"Shein: \nUltra Fast Fashion, Labelklau, keine Transparenz, Polyester 1000, furchtbare Arbeitsbedingungen, ""Casino Features"", Greenwashing, Verdacht auf Kinderarbeit\n\nVERSUS\n\nKiNder traGeN in DeutsChlANd ZeitUNgen aUs!!!1111 https://t.co/EI82fvMV79",53,1104,51,7,https://twitter.com/Mr_JK27/status/1555550361569591296,de,
2022-08-05 13:30:18+00:00,aalkonsum,⚓ Cpt. Aalkonsum 🐳,Das einfache Account-Rezept: •100g Musik •100g Allerlei vom Tag •100g FCB •250g Mett | Eine Stimme aus dem Radio (wirklich): Hier private Meinung!,False,retweet,"Shein: \nUltra Fast Fashion, Labelklau, keine Transparenz, Polyester 1000, furchtbare Arbeitsbedingungen, ""Casino Features"", Greenwashing, Verdacht auf Kinderarbeit\n\nVERSUS\n\nKiNder traGeN in DeutsChlANd ZeitUNgen aUs!!!1111 https://t.co/EI82fvMV79",53,1104,51,7,https://twitter.com/aalkonsum/status/1555546740891258880,de,
2022-08-05 13:28:47+00:00,Vallelel,Valle 🧋,life… is roblox 🗣️💯❗️,False,retweet,"Shein: \nUltra Fast Fashion, Labelklau, keine Transparenz, Polyester 1000, furchtbare Arbeitsbedingungen, ""Casino Features"", Greenwashing, Verdacht auf Kinderarbeit\n\nVERSUS\n\nKiNder traGeN in DeutsChlANd ZeitUNgen aUs!!!1111 https://t.co/EI82fvMV79",53,1104,51,7,https://twitter.com/Vallelel/status/1555546358727204865,de,
2022-08-05 13:27:40+00:00,oOTsukiOo,Son Öko,he/him • Dog Daddy • allergic to life • book addicted • earns money to not starve • #NoNazis,False,retweet,"Shein: \nUltra Fast Fashion, Labelklau, keine Transparenz, Polyester 1000, furchtbare Arbeitsbedingungen, ""Casino Features"", Greenwashing, Verdacht auf Kinderarbeit\n\nVERSUS\n\nKiNder traGeN in DeutsChlANd ZeitUNgen aUs!!!1111 https://t.co/EI82fvMV79",53,1104,51,7,https://twitter.com/oOTsukiOo/status/1555546077272612864,de,
2022-08-05 13:15:43+00:00,T3MPEST86,D4NNY,"INFJ, Würzburger in Hessen, Photographer, cat-dad, Music, Sci-Fi, Games, Destiny2, Neon Nerd, Dronepilot, Space-Addict, Retrowave. FCKAFD. BLM",False,retweet,"Shein: \nUltra Fast Fashion, Labelklau, keine Transparenz, Polyester 1000, furchtbare Arbeitsbedingungen, ""Casino Features"", Greenwashing, Verdacht auf Kinderarbeit\n\nVERSUS\n\nKiNder traGeN in DeutsChlANd ZeitUNgen aUs!!!1111 https://t.co/EI82fvMV79",53,1104,51,7,https://twitter.com/T3MPEST86/status/1555543072095834113,de,
2022-08-05 13:09:20+00:00,pastellblakk,charlie,20 y/o\nshe/they,False,retweet,"Shein: \nUltra Fast Fashion, Labelklau, keine Transparenz, Polyester 1000, furchtbare Arbeitsbedingungen, ""Casino Features"", Greenwashing, Verdacht auf Kinderarbeit\n\nVERSUS\n\nKiNder traGeN in DeutsChlANd ZeitUNgen aUs!!!1111 https://t.co/EI82fvMV79",53,1104,51,7,https://twitter.com/pastellblakk/status/1555541463563472901,de,
2022-08-05 12:58:36+00:00,mrorbt,:),,False,retweet,"Shein: \nUltra Fast Fashion, Labelklau, keine Transparenz, Polyester 1000, furchtbare Arbeitsbedingungen, ""Casino Features"", Greenwashing, Verdacht auf Kinderarbeit\n\nVERSUS\n\nKiNder traGeN in DeutsChlANd ZeitUNgen aUs!!!1111 https://t.co/EI82fvMV79",53,1104,51,7,https://twitter.com/mrorbt/status/1555538763413061632,de,
2022-08-05 12:51:15+00:00,Ich_halt_,Die immer Lachende,DogMom; Star Wars; Architekur MA;\nhttps://t.co/KYrNSLg1K5\n                       #SchleFaZ: https://t.co/94e5KqUkOy,False,retweet,"Shein: \nUltra Fast Fashion, Labelklau, keine Transparenz, Polyester 1000, furchtbare Arbeitsbedingungen, ""Casino Features"", Greenwashing, Verdacht auf Kinderarbeit\n\nVERSUS\n\nKiNder traGeN in DeutsChlANd ZeitUNgen aUs!!!1111 https://t.co/EI82fvMV79",53,1104,51,7,https://twitter.com/Ich_halt_/status/1555536914018598912,de,
2022-08-05 12:50:41+00:00,infoluencer,infoluencer 🆗️,"Lebe nicht dein Leben, poste deinen Traum!\nKritisches, Unterhaltsames & Infos aus der social media Welt.\nAchtung, könnte Satire & private Meinung enthalten!",False,original,"Shein: \nUltra Fast Fashion, Labelklau, keine Transparenz, Polyester 1000, furchtbare Arbeitsbedingungen, ""Casino Features"", Greenwashing, Verdacht auf Kinderarbeit\n\nVERSUS\n\nKiNder traGeN in DeutsChlANd ZeitUNgen aUs!!!1111 https://t.co/EI82fvMV79",53,1104,51,7,https://twitter.com/infoluencer/status/1555536773110956032,de,
2022-08-03 15:45:26+00:00,thecircularline,The Circular Line,regenerative farming + fashion  | c/o @emanuelalex_,False,retweet,"Can #fastfashion brands like @Shein ever be #sustainable? 🤷🏽‍♂️ Until it has reconsidered its use of #plastic-based fibers, is transparent about its environmental impact, and scales down overproduction, it won't ever be. via @surfacemag #greenwashing https://t.co/vfHMZYJLKB",2,3,0,0,https://twitter.com/thecircularline/status/1554855975147999236,en,
2022-08-02 21:18:19+00:00,_DirtyFashion_,Dirty Fashion List,Keeping track of dirty fashion retailers via our list. Everyone can add and edit. Follow link below to see spreadsheet. #DirtyFashion #FastFashion,False,retweet,"Can #fastfashion brands like @Shein ever be #sustainable? 🤷🏽‍♂️ Until it has reconsidered its use of #plastic-based fibers, is transparent about its environmental impact, and scales down overproduction, it won't ever be. via @surfacemag #greenwashing https://t.co/vfHMZYJLKB",2,3,0,0,https://twitter.com/_DirtyFashion_/status/1554577358539132933,en,
2022-08-02 20:33:00+00:00,greenwashdotcom,Greenwash.com,Take our site for a spin and see what comes out in the wash. \nA collaborative project owned by @changingmarkets to expose #greenwashing,True,original,"Can #fastfashion brands like @Shein ever be #sustainable? 🤷🏽‍♂️ Until it has reconsidered its use of #plastic-based fibers, is transparent about its environmental impact, and scales down overproduction, it won't ever be. via @surfacemag #greenwashing https://t.co/vfHMZYJLKB",2,3,0,0,https://twitter.com/greenwashdotcom/status/1554565952905220096,en,
2022-08-02 08:14:51+00:00,johnaddams2022,PARODY - JEWISH SPACE LASER Captain Count De Monet,"Don't get mad, VOTE\n#NeverForget 1/6/21\n#PoorPeoplesCampaign\n#ClimateChange\n#VotingRightsAct\n#joebuildsbridges\n#blacklivesmatter\n#ClimateCrisis\n#BuildBackBetter",False,retweet,"😡😡#GREENWASHING!\n\nOn their website, Shein names itself a vegan brand, using neither leather nor fur. Find out how we are being conned by these big polluting organisations! 🤯🤯 &gt;&gt; https://t.co/mGLUomSCOO\n \n.@LDIFoundation\n#ClimateEmergency #BreakFreeFromPlastic #PlasticFreeJuly https://t.co/yteASGD0vF",3,6,0,0,https://twitter.com/johnaddams2022/status/1554380192109498368,en,
2022-07-31 14:12:17+00:00,Nigellicus,Niggle By Leaf ⧖,"Author of The Cloak Of Feathers, out in Jan 2018 and The Maloney's Magical Weatherbox. Wants an Easter egg. Now. He/him.",False,retweet,"😡😡#GREENWASHING!\n\nOn their website, Shein names itself a vegan brand, using neither leather nor fur. Find out how we are being conned by these big polluting organisations! 🤯🤯 &gt;&gt; https://t.co/mGLUomSCOO\n \n.@LDIFoundation\n#ClimateEmergency #BreakFreeFromPlastic #PlasticFreeJuly https://t.co/yteASGD0vF",3,6,0,0,https://twitter.com/Nigellicus/status/1553745366079643648,en,
2022-07-31 14:04:49+00:00,atsushi_tamaki,Atsushi Tamaki,"Teaching License & Curator qualification holder/born 14-5-1973/\nNo DM/ I like Democracy./I reject Far right, right wing and nationalists,racist.",False,retweet,"😡😡#GREENWASHING!\n\nOn their website, Shein names itself a vegan brand, using neither leather nor fur. Find out how we are being conned by these big polluting organisations! 🤯🤯 &gt;&gt; https://t.co/mGLUomSCOO\n \n.@LDIFoundation\n#ClimateEmergency #BreakFreeFromPlastic #PlasticFreeJuly https://t.co/yteASGD0vF",3,6,0,0,https://twitter.com/atsushi_tamaki/status/1553743487434379264,en,
2022-07-31 14:00:07+00:00,Greenpeaceafric,Greenpeace Africa,We are part of a growing movement of Africans building a better world.,False,original,"😡😡#GREENWASHING!\n\nOn their website, Shein names itself a vegan brand, using neither leather nor fur. Find out how we are being conned by these big polluting organisations! 🤯🤯 &gt;&gt; https://t.co/mGLUomSCOO\n \n.@LDIFoundation\n#ClimateEmergency #BreakFreeFromPlastic #PlasticFreeJuly https://t.co/yteASGD0vF",3,6,0,0,https://twitter.com/Greenpeaceafric/status/1553742306519314433,en,
2022-07-29 04:08:32+00:00,gwenchanaaa,GWENCHANAAA,new york cutie 🌃🗽🌇,False,reply,"@jelbacon Hi Sir Jesse! Shein is the biggest fast fashion brand in the world right now. They mass-produce cheap quality of clothes made from hazardous materials (eg. microplastics) and even exploits labor. \n\nTheir partnership with BP is also a ""greenwashing"" scheme. https://t.co/G61QSgelPF",0,2,2,0,https://twitter.com/gwenchanaaa/status/1552868654857191424,en,
2022-07-28 11:00:43+00:00,saydocompany,The Say Do Company,Helping businesses drive profit by creating synergy between commercial performance & sustainability.,False,original,"Fast Fashion Giant Shein announced a $15m donation to an American-Ghanaian charity, to help address the rising global textile waste problem and support labour workers. \n\nIs this a form of ""greenwashing""?\n\n#Greenwashing #SayDoGap\n\nhttps://t.co/HcJPn3vMef https://t.co/yDa7ylGFoC",0,0,0,0,https://twitter.com/saydocompany/status/1552609993924513792,en,
2022-07-27 05:05:09+00:00,thelindatron,Linda,Hospitality/Travel Product designer + #UX Enthusiast more than likely rambling about #Design #Tech #Photography #Dogs #Sobriety & #Wrestling 💀🤘🏻👩🏻‍🎤 🐶,False,original,"Ultrafast fashion giant Shein takes greenwashing to a new low: charitywash, via @greenpeace https://t.co/wLilW1cdtp",0,0,0,0,https://twitter.com/thelindatron/status/1552158127507660800,en,
2022-07-19 21:28:15+00:00,mariamelshayeb1,Mariam Elshayeb,,False,quote,#Sustainability #fastfashion #greenwashing #fashion @ZARA @Mango @SHEIN_Official @hm @Gap @madewell https://t.co/SFVGnibx7M,0,0,0,0,https://twitter.com/mariamelshayeb1/status/1549506428624420864,qme,
2022-07-18 12:18:30+00:00,_DirtyFashion_,Dirty Fashion List,Keeping track of dirty fashion retailers via our list. Everyone can add and edit. Follow link below to see spreadsheet. #DirtyFashion #FastFashion,False,retweet,"#Fastfashion retailers increasingly set up strategic partnerships with sustainable and/or social organisations (Shein/Or Foundation, H&amp;M/BFABW, Primark/Fairtrade, etc.) - do you think they're #greenwashing, or should we be celebrating this apparent shift?\nhttps://t.co/srqGAYDAW2",1,0,2,0,https://twitter.com/_DirtyFashion_/status/1549005690601185281,en,
2022-07-18 10:58:32+00:00,BanannaPlanet,Joanna | Planet Bananna,blogger at https://t.co/xdmjXGrImj ° earth advocate ° @remakeourworld ambassador \nsubscribe to my monthly newsletter: https://t.co/KUu8NyUnvX,False,original,"#Fastfashion retailers increasingly set up strategic partnerships with sustainable and/or social organisations (Shein/Or Foundation, H&amp;M/BFABW, Primark/Fairtrade, etc.) - do you think they're #greenwashing, or should we be celebrating this apparent shift?\nhttps://t.co/srqGAYDAW2",1,0,2,0,https://twitter.com/BanannaPlanet/status/1548985565462368259,en,
2022-07-18 08:49:28+00:00,weIIsprings,inkwizycja xcx,united in grief,False,reply,zesram sie greenwashing edycja shein,0,0,0,0,https://twitter.com/weIIsprings/status/1548953086361837569,pl,
2022-07-17 22:27:56+00:00,maloseforfree,Malose the Chief,Make a difference,False,retweet,"A few days ago, @SHEIN_Official announced a $15m donation to an NGO working with textile waste workers in Ghana.\n\nBut without any drastic change to its ultra-fast-fashion model, this is in fact nothing more than a #greenwashing stunt.\n\n#DetoxMyFashion https://t.co/kT1O2y6vMx",36,90,1,2,https://twitter.com/maloseforfree/status/1548796670913253378,en,
2022-07-17 15:39:54+00:00,szare_krokodyle,°•Adiikmno•°,"🖇 Tak bardzo mnie wkurwia to, że nie rozumiem\n\n°•She/Her•°  20,5yo          dyslexic",False,retweet,"@dzban69 Ja bym jeszcze dodała powszechny greenwashing w fast fashion. Często jak firmy piszą, że są eko to wcale nie są, ale to ładnie brzmi, a przecież klient nie będzie tego sprawdzał na zakupach. \nI Shein kradnie projekty od małych projektantów",1,9,1,0,https://twitter.com/szare_krokodyle/status/1548693989011988482,pl,
2022-07-17 15:39:11+00:00,louleroidumonde,Julia 🌻 misses Harry and Louis,"we can make history ▪︎\nshe/her ▪︎\n12.12.2020, 14.04.2022 Louis ▪︎ \n02.07.2023 Harry ▪︎\nDavid Dawson fan account",False,reply,"@dzban69 Ja bym jeszcze dodała powszechny greenwashing w fast fashion. Często jak firmy piszą, że są eko to wcale nie są, ale to ładnie brzmi, a przecież klient nie będzie tego sprawdzał na zakupach. \nI Shein kradnie projekty od małych projektantów",1,9,1,0,https://twitter.com/louleroidumonde/status/1548693806597521408,pl,
2022-07-12 15:04:11+00:00,juliusr023,Julius Ramirez,south🔚Tx 4️⃣ LLJ LLL LLA❤️🕊,False,retweet,"@messygirI Resellers like to present it as ethical, but that couldn't be farther from the truth. It's just bs greenwashing. And it pushes the lower/lower middle classes to purchase MORE throwaway fashion like Shein. That's what actually ends up in landfills and on Ghana's shores. https://t.co/LjEeFiohrG",6,103,1,1,https://twitter.com/juliusr023/status/1546873060296376320,en,
2022-07-12 00:57:02+00:00,Bquashh,jeanut butter,Black // ancom // antifash // she/they // idk what else lmao,False,retweet,"@messygirI Resellers like to present it as ethical, but that couldn't be farther from the truth. It's just bs greenwashing. And it pushes the lower/lower middle classes to purchase MORE throwaway fashion like Shein. That's what actually ends up in landfills and on Ghana's shores. https://t.co/LjEeFiohrG",6,103,1,1,https://twitter.com/Bquashh/status/1546659866055479296,en,
2022-07-11 18:06:52+00:00,kalykat_,Kalysta Lee,she/they  mestiza💅,False,retweet,"@messygirI Resellers like to present it as ethical, but that couldn't be farther from the truth. It's just bs greenwashing. And it pushes the lower/lower middle classes to purchase MORE throwaway fashion like Shein. That's what actually ends up in landfills and on Ghana's shores. https://t.co/LjEeFiohrG",6,103,1,1,https://twitter.com/kalykat_/status/1546556646188404736,en,
2022-07-11 16:01:24+00:00,NucD,Nuc,[January 8th 1990] [he/him],False,retweet,"@messygirI Resellers like to present it as ethical, but that couldn't be farther from the truth. It's just bs greenwashing. And it pushes the lower/lower middle classes to purchase MORE throwaway fashion like Shein. That's what actually ends up in landfills and on Ghana's shores. https://t.co/LjEeFiohrG",6,103,1,1,https://twitter.com/NucD/status/1546525070604091395,en,
2022-07-11 14:55:07+00:00,IRLNecoArc,lukes guy walker!??,Vlad / V / 23 / he/they | i tweet about NONSENSE | 18+ | sillay guy with a sillay guy @chyadc ♥️♥️♥️|,False,retweet,"@messygirI Resellers like to present it as ethical, but that couldn't be farther from the truth. It's just bs greenwashing. And it pushes the lower/lower middle classes to purchase MORE throwaway fashion like Shein. That's what actually ends up in landfills and on Ghana's shores. https://t.co/LjEeFiohrG",6,103,1,1,https://twitter.com/IRLNecoArc/status/1546508391249416193,en,
2022-07-11 07:05:24+00:00,troublepeach12,troublepeach12 🇲🇽🇺🇸☭,23. commie cath goth faerie 🌿 💅\nin my *let people enjoy things* era.\nnot usually a hater but depraved Twitter takes makes me one :(,False,reply,"@messygirI Resellers like to present it as ethical, but that couldn't be farther from the truth. It's just bs greenwashing. And it pushes the lower/lower middle classes to purchase MORE throwaway fashion like Shein. That's what actually ends up in landfills and on Ghana's shores. https://t.co/LjEeFiohrG",6,103,1,1,https://twitter.com/troublepeach12/status/1546390180575162368,en,
